resort_name,name,location_type,latitude,longitude,elevation_feet,is_primary,notes,source_url
Chamonix Mont-Blanc Valley,Brévent / Flégère Top,summit,45.92328,6.868141,8284,false,"Official Chamonix valley guide lists Le Brévent / La Flégère as 1,095 m - 2,525 m. Source does not publish exact latitude/longitude for this point in captured text; coordinates reuse the resort forecast-point location and are approximate.",https://www.experiencechamonix.com/wp-content/uploads/guide_2025_web.pdf
Chamonix Mont-Blanc Valley,Grands Montets Lower Ski Area,base,45.92328,6.868141,4052,false,"Official Chamonix valley guide lists Les Grands Montets as 1,235 m - 3,275 m; lower ski-area altitude entered as a non-primary base/sector anchor. Source does not publish exact latitude/longitude for this point in captured text; coordinates reuse the resort forecast-point location and are approximate.",https://www.experiencechamonix.com/wp-content/uploads/guide_2025_web.pdf
Chamonix Mont-Blanc Valley,Grands Montets Upper Ski Area,summit,45.92328,6.868141,10745,false,"Official Chamonix valley guide lists Les Grands Montets upper ski-area altitude as 3,275 m. Source does not publish exact latitude/longitude for this point in captured text; coordinates reuse the resort forecast-point location and are approximate.",https://www.experiencechamonix.com/wp-content/uploads/guide_2025_web.pdf
Zermatt Matterhorn,Matterhorn Glacier Paradise Peak,summit,46.0257,7.751637,12740,false,"Official Zermatt tourism page identifies Matterhorn Glacier Paradise as the highest mountain station in Europe at 3,883 m. Source does not publish exact latitude/longitude for this point in captured text; coordinates reuse the resort forecast-point location and are approximate.",https://zermatt.swiss/Media/Attraktionen/Talstation-Matterhorn-Glacier-Paradise
Verbier,Mont-Fort,summit,46.096,7.229,10925,false,"Official Verbier 4Vallées ski/snowboard page identifies Mont-Fort as the highest point of Verbier 4Vallées at 3,330 m. Source does not publish exact latitude/longitude for this point in captured text; coordinates reuse the resort forecast-point location and are approximate.",https://verbier4vallees.ch/en/experiences-in-verbier/ski-and-snowboard
Verbier,Mont-Gelé,summit,46.096,7.229,9918,false,"Official Verbier 4Vallées Mont-Gelé freeride page states the cable car reaches 3,023 m and lists official freeride itinerary altitude bands from Mont-Gelé toward La Chaux/Tortin. Source does not publish exact latitude/longitude for this point in captured text; coordinates reuse the resort forecast-point location and are approximate.",https://verbier4vallees.ch/en/experiences-in-verbier/freeriding/mont-gele
Verbier,La Chaux Freeride Finish,other,46.096,7.229,7972,false,"Official Verbier 4Vallées Mont-Gelé page lists Mont-Gelé - Chaux route altitude from 3,003 m to 2,430 m; this is a route finish/elevation anchor, not a weather station. Source does not publish exact latitude/longitude for this point in captured text; coordinates reuse the resort forecast-point location and are approximate.",https://verbier4vallees.ch/en/experiences-in-verbier/freeriding/mont-gele
Verbier,Tortin Freeride Finish,other,46.096,7.229,6709,false,"Official Verbier 4Vallées Mont-Gelé page lists Mont-Gelé - Tortin route altitude from 3,003 m to 2,045 m; this is a route finish/elevation anchor, not a weather station. Source does not publish exact latitude/longitude for this point in captured text; coordinates reuse the resort forecast-point location and are approximate.",https://verbier4vallees.ch/en/experiences-in-verbier/freeriding/mont-gele
Val Thorens,Caron 3200,summit,45.298,6.583,10499,false,"Official Val Thorens resort page references Caron 3200 as a high ski-area development/experience point; entered as an official high-elevation anchor, not a named weather station. Source does not publish exact latitude/longitude for this point in captured text; coordinates reuse the resort forecast-point location and are approximate.",https://www.valthorens.com/en/decouvrir/la-station-val-thorens/
Courchevel,La Saulire,summit,45.415,6.634,8983,false,"Official Courchevel villages page identifies La Saulire as the highest point of the resort at 2,738 m. Source does not publish exact latitude/longitude for this point in captured text; coordinates reuse the resort forecast-point location and are approximate.",https://courchevel.com/en/une-station-6-villages
Méribel,Roc de Fer,summit,45.397,6.566,7526,false,"Official Méribel page identifies Roc de Fer at 2,294 m as a summit/viewpoint in the Méribel valley. Source does not publish exact latitude/longitude for this point in captured text; coordinates reuse the resort forecast-point location and are approximate.",https://www.meribel.net/en/meribel-best-hidden-spots/
Méribel,Mont Vallon,summit,45.397,6.566,9685,false,"Official Méribel page identifies Mont Vallon as an emblematic summit at 2,952 m. Source does not publish exact latitude/longitude for this point in captured text; coordinates reuse the resort forecast-point location and are approximate.",https://www.meribel.net/en/meribel-best-hidden-spots/
Sölden,Highest Ski Area Elevation,summit,46.965,11.01,10958,false,"Official Sölden ski-area information page lists the upper ski-area elevation as 3,340 m. Source does not publish exact latitude/longitude for this point in captured text; coordinates reuse the resort forecast-point location and are approximate.",https://www.soelden.com/winter/ski-area/information-on-the-ski-area.html
Ischgl,Silvretta Arena Highest Slope Elevation,summit,47.009736,10.289257,9423,false,"Official Ischgl press release states Silvretta Arena slopes reach 2,872 m. Source does not publish exact latitude/longitude for this point in captured text; coordinates reuse the resort forecast-point location and are approximate.",https://www.ischgl.com/001_TVB/PRESSE/3_Archiv/2023/2023-10-24%20TOM%20Easter%20Chuba/PA_TOM_Easter_NinaChuba_24_EN.pdf
Ischgl,Idalp / Top of the Mountain Stage,mid_mountain,47.009736,10.289257,7612,false,"Official Ischgl press release identifies the Top of the Mountain stage in the heart of the ski area at 2,320 m; event/stage elevation anchor, not a weather station. Source does not publish exact latitude/longitude for this point in captured text; coordinates reuse the resort forecast-point location and are approximate.",https://www.ischgl.com/001_TVB/PRESSE/3_Archiv/2023/2023-10-24%20TOM%20Easter%20Chuba/PA_TOM_Easter_NinaChuba_24_EN.pdf
St. Anton am Arlberg,Valluga Peak,summit,47.129,10.268,9222,false,"Official regional St. Anton/Arlberg page identifies Valluga peak at 2,811 m as the highest point. Source does not publish exact latitude/longitude for this point in captured text; coordinates reuse the resort forecast-point location and are approximate.",https://www.bergwelttirol.at/en/winter/skiing-at-the-arlberg
Kitzsteinhorn,Kitzsteinhorn / Top of Salzburg Summit Station,summit,47.188,12.687,9938,false,"Official Kitzsteinhorn page lists the ski/resort upper elevation around 3,000 m and references Top of Salzburg at 3,029 m; row uses 3,029 m summit-station elevation. Source does not publish exact latitude/longitude for this point in captured text; coordinates reuse the resort forecast-point location and are approximate.",https://www.kitzsteinhorn.at/en/service/backstage/press/winter-2025-26-pr15634
Hintertux Glacier,Panorama Terrace / Glacier Highest Area,summit,47.115,11.682,10663,false,"Official Tux/Hintertux Glacier page identifies the panorama terrace at 3,250 m. Source does not publish exact latitude/longitude for this point in captured text; coordinates reuse the resort forecast-point location and are approximate.",https://www.tux.at/en/hintertux-glacier/
Zillertal Arena,Übergangsjoch Highest Point,summit,47.23,12.14,8202,false,"Official Zillertal Arena FAQ states the highest point is Übergangsjoch at 2,500 m. Source does not publish exact latitude/longitude for this point in captured text; coordinates reuse the resort forecast-point location and are approximate.",https://www.zillertalarena.com/en/information-services/holiday-information/faq/
Mayrhofen,Mount Penken High Elevation,summit,47.166,11.863,8202,false,"Official Mayrhofen story/FAQ states Mountopolis reaches up to approximately 2,500 m at Mount Penken. Source does not publish exact latitude/longitude for this point in captured text; coordinates reuse the resort forecast-point location and are approximate.",https://www.mayrhofen.at/en/stories/sunshine-skiing-in-the-zillertal
Kronplatz/Plan de Corones,Kronplatz Summit / Via Artis Highest Point,summit,46.741,11.966,7464,false,"Official Dolomiti Superski Via Artis page lists highest point 2,275 m on the Kronplatz summit plateau. Source does not publish exact latitude/longitude for this point in captured text; coordinates reuse the resort forecast-point location and are approximate.",https://www.dolomitisuperski.com/en/outdoor~Sentiero-Via-Artis_17752880~
Arabba/Marmolada,Ombretta Pass Route Highest Point,summit,46.497,11.874,8855,false,"Official Dolomiti Superski Arabba/Marmolada route page lists highest point 2,699 m. Source does not publish exact latitude/longitude for this point in captured text; coordinates reuse the resort forecast-point location and are approximate.",https://www.dolomitisuperski.com/en/SuperSummer/Discover/Regions/3-Zinnen-Dolomites/Attivita/Hike-Galaxy-3Cime~Malga-Ciapela-Ombretta-Pass_57379891~
Alta Badia,Cherz Plateau Route Highest Point,summit,46.551,11.879,6824,false,"Official Dolomiti Superski Alta Badia/Arabba route page lists highest point 2,080 m. Source does not publish exact latitude/longitude for this point in captured text; coordinates reuse the resort forecast-point location and are approximate.",https://www.dolomitisuperski.com/en/SuperSummer/Discover/Regions/Alta-Badia/Attivita-in-Alta-Badia/Hike-Galaxy-Alta-Badia~Passo-Incisa-e-Altopiano-del-Cherz_67135782~
Cortina d’Ampezzo,Sass de Stria Route Highest Point,summit,46.539,12.137,8153,false,"Official Dolomiti Superski Cortina/Arabba route page lists highest point 2,485 m. Source does not publish exact latitude/longitude for this point in captured text; coordinates reuse the resort forecast-point location and are approximate.",https://www.dolomitisuperski.com/en/outdoor~Escursione-al-Sass-de-Stria_805072633~
Val Gardena/Alpe di Siusi,Royal Dolomites Tour Highest Point,summit,46.557,11.756,7372,false,"Official Dolomiti Superski Royal Dolomites Tour page lists highest point 2,247 m across the linked domains including Val Gardena/Alpe di Siusi. Source does not publish exact latitude/longitude for this point in captured text; coordinates reuse the resort forecast-point location and are approximate.",https://www.dolomitisuperski.com/en/SuperSummer/Discover/Hike%20Galaxy~458-Royal-Dolomites-Tour-2025_807953860~
Val di Fassa/Carezza,Royal Dolomites Tour Highest Point,summit,46.43,11.684,7372,false,"Official Dolomiti Superski Royal Dolomites Tour page lists highest point 2,247 m across the linked domains including Val di Fassa/Carezza. Source does not publish exact latitude/longitude for this point in captured text; coordinates reuse the resort forecast-point location and are approximate.",https://www.dolomitisuperski.com/en/SuperSummer/Discover/Hike%20Galaxy~458-Royal-Dolomites-Tour-2025_807953860~
Val di Fiemme/Obereggen,Royal Dolomites Tour Highest Point,summit,46.354,11.549,7372,false,"Official Dolomiti Superski Royal Dolomites Tour page lists highest point 2,247 m across the linked domains including Obereggen; primary remains existing forecast-point row pending source-specific base metadata. Source does not publish exact latitude/longitude for this point in captured text; coordinates reuse the resort forecast-point location and are approximate.",https://www.dolomitisuperski.com/en/SuperSummer/Discover/Hike%20Galaxy~458-Royal-Dolomites-Tour-2025_807953860~
Civetta,Ronch Route Highest Point,summit,46.37836,12.04852,5354,false,"Official Dolomiti Superski Civetta route page lists highest point 1,632 m. Source does not publish exact latitude/longitude for this point in captured text; coordinates reuse the resort forecast-point location and are approximate.",https://www.dolomitisuperski.com/en/SuperSummer/Discover/Regions/Civetta/Attivita/Hike-Galaxy-in-Civetta~I-monoliti-di-Ronch_57379597~
Madonna di Campiglio,Unified Skiarea Upper Elevation,summit,46.23,10.826,8202,false,"Official Campiglio Dolomiti page states the interconnected skiarea reaches 2,500 m. Source does not publish exact latitude/longitude for this point in captured text; coordinates reuse the resort forecast-point location and are approximate.",https://www.campigliodolomiti.it/en/skiarea/inverno/skiarea-madonna-di-campiglio?landing=605
Pinzolo,Unified Skiarea Upper Elevation,summit,46.16,10.765,8202,false,"Official Campiglio Dolomiti page states the interconnected skiarea reaches 2,500 m. Source does not publish exact latitude/longitude for this point in captured text; coordinates reuse the resort forecast-point location and are approximate.",https://www.campigliodolomiti.it/en/skiarea/inverno/skiarea-madonna-di-campiglio?landing=605
Folgarida-Marilleva,Unified Skiarea Upper Elevation,summit,46.3,10.865,8202,false,"Official Campiglio Dolomiti page states the interconnected skiarea reaches 2,500 m. Source does not publish exact latitude/longitude for this point in captured text; coordinates reuse the resort forecast-point location and are approximate.",https://www.campigliodolomiti.it/en/skiarea/inverno/skiarea-madonna-di-campiglio?landing=605
Pila,Pila Ski Area Upper Elevation,summit,45.6814,7.3125,8858,false,"Official Pila ski-area page states the pistes reach up to 2,700 m altitude. Source does not publish exact latitude/longitude for this point in captured text; coordinates reuse the resort forecast-point location and are approximate.",https://pila.it/en/ski-area/
La Thuile - Espace San Bernardo,Les Suches,mid_mountain,45.7131,6.9492,7218,false,"Official La Thuile page states lifts from La Thuile reach Les Suches at 2,200 m. Source does not publish exact latitude/longitude for this point in captured text; coordinates reuse the resort forecast-point location and are approximate.",https://www.lathuile.it/it/il-comprensorio
La Thuile - Espace San Bernardo,Mont Valaisan / Espace San Bernardo High Point,summit,45.7131,6.9492,9485,false,"Official Espace San Bernardo skirama labels Mont Valaisan at 2,891 m and La Thuile at 1,441 m. Source does not publish exact latitude/longitude for this point in captured text; coordinates reuse the resort forecast-point location and are approximate.",https://cms.lathuile.it/uploads/25_Skirama_Espace_San_Bernardo_4e8e59b9fe.pdf
Courmayeur Mont Blanc,Aretu Snowpark Area,mid_mountain,45.7963,6.9689,6562,false,"Official Courmayeur Mountain Stats PDF lists Snowpark Aretu Area altitude 2,000 m. Source does not publish exact latitude/longitude for this point in captured text; coordinates reuse the resort forecast-point location and are approximate.",https://www.courmayeur-montblanc.com/app/uploads/2024/10/Mountain-stats-2024-2025.pdf
Courmayeur Mont Blanc,Cresta d’Arp,summit,45.7963,6.9689,9039,false,"Official Valle d’Aosta tourism page states the Courmayeur runs reach Cresta d’Arp at 2,755 m. Source does not publish exact latitude/longitude for this point in captured text; coordinates reuse the resort forecast-point location and are approximate.",https://www.lovevda.it/en/database/5/downhill-skiing/courmayeur/courmayeur-mont-blanc-ski-area/4360?link_id=b0cdbe9d-3179-4b91-87e4-1dbfd6c3a48a
Cervino Ski Paradise,Plateau Rosa Cable-Car Elevation,summit,45.9340,7.6296,11417,false,"Official Cervinia/Cervino event page states ascent by cable car to Plateau Rosa at 3,480 m. Source does not publish exact latitude/longitude for this point in captured text; coordinates reuse the resort forecast-point location and are approximate.",https://www.cervinia.it/en/eventi/cervinia-snow-bike-2024
Cervino Ski Paradise,Plateau Rosa Glacier Descent Start,summit,45.9340,7.6296,11483,false,"Official Cervinia/Cervino event page describes the descent from the Plateau Rosa glacier at 3,500 m. Source does not publish exact latitude/longitude for this point in captured text; coordinates reuse the resort forecast-point location and are approximate.",https://www.cervinia.it/en/eventi/cervinia-snow-bike-2024
Jigatake Snow Resort,Highest Course Elevation,summit,36.568,137.846,3937,false,Official Hakuba Valley snow-resort info page lists Jigatake Snow Resort highest course elevation 1200 m. Source does not publish exact latitude/longitude for this point in captured text; coordinates reuse the resort forecast-point location and are approximate.,https://www.hakubavalley.com/en/ski_resort_info_en/
Kashimayari Snow Resort,Highest Course Elevation,summit,36.605,137.846,4331,false,Official Hakuba Valley snow-resort info page lists Kashimayari Snow Resort highest course elevation 1320 m. Source does not publish exact latitude/longitude for this point in captured text; coordinates reuse the resort forecast-point location and are approximate.,https://www.hakubavalley.com/en/ski_resort_info_en/
White Resort Hakuba Sanosaka,Highest Course Elevation,summit,36.645,137.847,3937,false,Official Hakuba Valley snow-resort info page lists White Resort Hakuba Sanosaka highest course elevation 1200 m. Source does not publish exact latitude/longitude for this point in captured text; coordinates reuse the resort forecast-point location and are approximate.,https://www.hakubavalley.com/en/ski_resort_info_en/
ABLE Hakuba Goryu Snow Resort,Highest Course Elevation,summit,36.662,137.836,5499,false,Official Hakuba Valley snow-resort info page lists ABLE Hakuba Goryu Snow Resort highest course elevation 1676 m. Source does not publish exact latitude/longitude for this point in captured text; coordinates reuse the resort forecast-point location and are approximate.,https://www.hakubavalley.com/en/ski_resort_info_en/
Hakuba 47 Winter Sports Park,Highest Course Elevation,summit,36.691,137.832,5295,false,Official Hakuba Valley snow-resort info page lists Hakuba 47 Winter Sports Park highest course elevation 1614 m. Source does not publish exact latitude/longitude for this point in captured text; coordinates reuse the resort forecast-point location and are approximate.,https://www.hakubavalley.com/en/ski_resort_info_en/
Hakuba Happo-one Snow Resort,Highest Course Elevation,summit,36.702,137.835,6007,false,Official Hakuba Valley snow-resort info page lists Hakuba Happo-one Snow Resort highest course elevation 1831 m. Source does not publish exact latitude/longitude for this point in captured text; coordinates reuse the resort forecast-point location and are approximate.,https://www.hakubavalley.com/en/ski_resort_info_en/
Hakuba Iwatake Snow Field,Highest Course Elevation,summit,36.727,137.858,4229,false,Official Hakuba Valley snow-resort info page lists Hakuba Iwatake Snow Field highest course elevation 1289 m. Source does not publish exact latitude/longitude for this point in captured text; coordinates reuse the resort forecast-point location and are approximate.,https://www.hakubavalley.com/en/ski_resort_info_en/
Tsugaike Mountain Resort,Highest Course Elevation,summit,36.752,137.873,5591,false,Official Hakuba Valley snow-resort info page lists Tsugaike Mountain Resort highest course elevation 1704 m. Source does not publish exact latitude/longitude for this point in captured text; coordinates reuse the resort forecast-point location and are approximate.,https://www.hakubavalley.com/en/ski_resort_info_en/
Hakuba Norikura Onsen Snow Resort,Highest Course Elevation,summit,36.774,137.887,5243,false,Official Hakuba Valley snow-resort info page lists Hakuba Norikura Onsen Snow Resort highest course elevation 1598 m. Source does not publish exact latitude/longitude for this point in captured text; coordinates reuse the resort forecast-point location and are approximate.,https://www.hakubavalley.com/en/ski_resort_info_en/
Hakuba Cortina Snow Resort,Highest Course Elevation,summit,36.794,137.895,4600,false,Official Hakuba Valley snow-resort info page lists Hakuba Cortina Snow Resort highest course elevation 1402 m. Source does not publish exact latitude/longitude for this point in captured text; coordinates reuse the resort forecast-point location and are approximate.,https://www.hakubavalley.com/en/ski_resort_info_en/
Annupuri,Mt. Niseko Annupuri Shared Summit,summit,42.8047045,140.68749309999998,4291,false,"Official Niseko United page identifies Niseko Annupuri as 1,308 m and describes Annupuri, Grand Hirafu, Hanazono, and Niseko Village as four resorts on one mountain. Source does not publish exact latitude/longitude for this point in captured text; coordinates reuse the resort forecast-point location and are approximate.",https://www.niseko.ne.jp/en/niseko/
Grand Hirafu,Mt. Niseko Annupuri Shared Summit,summit,42.8047045,140.68749309999998,4291,false,"Official Niseko United page identifies Niseko Annupuri as 1,308 m and describes Annupuri, Grand Hirafu, Hanazono, and Niseko Village as four resorts on one mountain. Source does not publish exact latitude/longitude for this point in captured text; coordinates reuse the resort forecast-point location and are approximate.",https://www.niseko.ne.jp/en/niseko/
Hanazano,Mt. Niseko Annupuri Shared Summit,summit,42.8047045,140.68749309999998,4291,false,"Official Niseko United page identifies Niseko Annupuri as 1,308 m and describes Annupuri, Grand Hirafu, Hanazono, and Niseko Village as four resorts on one mountain. Source does not publish exact latitude/longitude for this point in captured text; coordinates reuse the resort forecast-point location and are approximate.",https://www.niseko.ne.jp/en/niseko/
Niseko Village,Mt. Niseko Annupuri Shared Summit,summit,42.8047045,140.68749309999998,4291,false,"Official Niseko United page identifies Niseko Annupuri as 1,308 m and describes Annupuri, Grand Hirafu, Hanazono, and Niseko Village as four resorts on one mountain. Source does not publish exact latitude/longitude for this point in captured text; coordinates reuse the resort forecast-point location and are approximate.",https://www.niseko.ne.jp/en/niseko/
Annupuri,Niseko United Mountain Base Report,weather_station,42.8047045,140.68749309999998,984,false,"Official Niseko United weather/lift-status page reports conditions by resort and includes a Mountain base section; no precise base elevation or station coordinate is published in captured text, so elevation is approximate and should be superseded by resort-specific station metadata. Source does not publish exact latitude/longitude for this point in captured text; coordinates reuse the resort forecast-point location and are approximate.",https://www.niseko.ne.jp/en/niseko-lift-status/
Grand Hirafu,Niseko United Mountain Base Report,weather_station,42.8047045,140.68749309999998,984,false,"Official Niseko United weather/lift-status page reports conditions by resort and includes a Mountain base section; no precise base elevation or station coordinate is published in captured text, so elevation is approximate and should be superseded by resort-specific station metadata. Source does not publish exact latitude/longitude for this point in captured text; coordinates reuse the resort forecast-point location and are approximate.",https://www.niseko.ne.jp/en/niseko-lift-status/
Hanazano,Niseko United Mountain Base Report,weather_station,42.8047045,140.68749309999998,984,false,"Official Niseko United weather/lift-status page reports conditions by resort and includes a Mountain base section; no precise base elevation or station coordinate is published in captured text, so elevation is approximate and should be superseded by resort-specific station metadata. Source does not publish exact latitude/longitude for this point in captured text; coordinates reuse the resort forecast-point location and are approximate.",https://www.niseko.ne.jp/en/niseko-lift-status/
Niseko Village,Niseko United Mountain Base Report,weather_station,42.8047045,140.68749309999998,984,false,"Official Niseko United weather/lift-status page reports conditions by resort and includes a Mountain base section; no precise base elevation or station coordinate is published in captured text, so elevation is approximate and should be superseded by resort-specific station metadata. Source does not publish exact latitude/longitude for this point in captured text; coordinates reuse the resort forecast-point location and are approximate.",https://www.niseko.ne.jp/en/niseko-lift-status/
Furano Ski Resort,Peak Elevation,summit,43.19,142.19,3524,false,"Official Prince Snow Resorts Furano page lists peak elevation 1,074 m. Source does not publish exact latitude/longitude for this point in captured text; coordinates reuse the resort forecast-point location and are approximate.",https://www.princehotels.com/en/ski/furano/index.html?gad_source=1
Furano Ski Resort,Furano Zone Summit Start,summit,43.19,142.19,3524,false,"Official Furano page describes first-track location as Furano Zone Summit Start; elevation uses the same official peak elevation of 1,074 m. Source does not publish exact latitude/longitude for this point in captured text; coordinates reuse the resort forecast-point location and are approximate.",https://www.princehotels.com/en/ski/furano/index.html?gad_source=1
Rusutsu Resort,East Mt. Peak / East No.1 Gondola,summit,42.735,140.913,2848,false,Official Rusutsu Resort blog states the East No.1 gondola takes guests to the peak at 868 m elevation. Source does not publish exact latitude/longitude for this point in captured text; coordinates reuse the resort forecast-point location and are approximate.,https://rusutsu.com/en/blog/032/
