resort_name,name,location_type,latitude,longitude,elevation_feet,is_primary,notes,source_url
Val Thorens,Primary Base / Forecast Point,base,45.298,6.583,7546,true,"Official Val Thorens resort page states the resort is at 2,300 m altitude, the highest station in Europe. Coordinates remain existing approximate resort/base forecast-point coordinates unless official point coordinates are later sourced.",https://www.valthorens.com/en/decouvrir/la-station-val-thorens/
Val di Fassa/Carezza,Primary Base / Forecast Point,base,46.43,11.684,2841,true,"Official Dolomiti Superski Royal Dolomites Tour page across Carezza, Val di Fassa, Obereggen, Val Gardena, Alpe di Siusi and Arabba/Marmolada lists lowest point 866 m and highest point 2,247 m; primary uses lower official multi-domain route anchor pending resort-specific station rows. Coordinates remain existing approximate resort/base forecast-point coordinates unless official point coordinates are later sourced.",https://www.dolomitisuperski.com/en/SuperSummer/Discover/Hike%20Galaxy~458-Royal-Dolomites-Tour-2025_807953860~
Val di Fiemme/Obereggen,Primary Base / Forecast Point,base,46.354,11.549,7044,true,"Primary first-pass weather forecast point derived from the resort coordinate in data/resorts.csv. Coordinates were previously sourced from official pass/resort CMS records, official resort pages, or reliable map/geocoding references; treat as approximate unless a future row identifies a specific official base, snow stake, or weather station. Elevation is DEM-derived from Open-Meteo Elevation API at this row's latitude/longitude (2147 m / 7044 ft), not an official resort-reported station elevation; use as fallback until official base/mid/summit/snow-stake elevation is sourced. Original location/source reference: https://www.dolomitisuperski.com/en.",https://api.open-meteo.com/v1/elevation?latitude=46.354&longitude=11.549
Valle Nevado,Snow Level / Base Reporting Elevation,base,-33.3545,-70.2488,9843,true,"Official Valle Nevado mountain report publishes weather/road/snow data and reports snow level at 3,000 m. Treat as reporting elevation/base snow context; coordinates approximate for Valle Nevado village/base area.",https://www.vallenevado.com/en/mountain-report/
Verbier,Primary Base / Forecast Point,base,46.096,7.229,4921,true,"Official Verbier 4Vallées content describes the Verbier ski area as extending from Verbier around 1,500 m up to Mont-Fort at 3,330 m; primary uses 1,500 m Verbier resort elevation. Coordinates remain existing approximate resort/base forecast-point coordinates unless official point coordinates are later sourced.",https://verbier4vallees.ch/en/experiences-in-verbier/ski-and-snowboard
Veysonnaz,Veysonnaz Village / Base,base,46.196,7.338,4429,true,Base forecast point for Veysonnaz in 4 Vallées. Base elevation approximate for village/access; shared 4 Vallées snow report used as fallback context.,https://www.skiresort.info/ski-resort/4-vallees-verbier-la-tzoumaz-nendaz-veysonnaz-thyon/snow-report/
Warth-Schröcken,Warth / Schröcken Base Context,base,47.258,10.184,4987,true,Official Warth-Schröcken snow report lists live webcams and elevations for multiple points. Primary base context uses Warth/Steffisalp-area approximate elevation.,https://www.warth-schroecken.at/en/winter/ski-area/snowreport.html
Whistler Mountain,Whistler Village / Official Base Elevation,base,50.0615,-122.9574,2214,true,"Official Whistler Blackcomb mountain-info page reports a resort base elevation of 2,214 ft. Coordinates are the existing resort-level Whistler Mountain coordinate and should be treated as approximate rather than a surveyed weather-station point.",https://www.whistlerblackcomb.com/the-mountain/about-the-mountain/mountain-info.aspx
White Resort Hakuba Sanosaka,Primary Base / Forecast Point,base,36.645,137.847,2428,true,Official Hakuba Valley snow-resort info page lists course elevation lowest 740 m and highest 1200 m for White Resort Hakuba Sanosaka; primary uses lowest official course elevation. Coordinates remain existing approximate resort/base forecast-point coordinates unless official point coordinates are later sourced.,https://www.hakubavalley.com/en/ski_resort_info_en/
Whitetail Resort,Base / Forecast Point,base,39.7417,-77.9336,865,true,"Official Whitetail mountain information reports base elevation 865 ft and highest elevation 1,800 ft. Primary base coordinate is approximate unless a later official station coordinate is added.",https://www.skiwhitetail.com/the-mountain/about-the-mountain/mountain-info.aspx
Whitetail Resort,Summit / Highest Elevation,summit,39.7417,-77.9336,1800,false,"Official Whitetail mountain information reports base elevation 865 ft and highest elevation 1,800 ft. Coordinate approximates the resort area because the official source gives elevation but not exact station coordinates.",https://www.skiwhitetail.com/the-mountain/about-the-mountain/mountain-info.aspx
Wildcat Mountain,Base / Forecast Point,base,44.2643,-71.2387,1950,true,"Official Wildcat mountain information reports base elevation 1,950 ft and highest elevation 4,062 ft. Primary base coordinate is approximate unless a later official station coordinate is added.",https://www.skiwildcat.com/the-mountain/about-the-mountain/mountain-info.aspx
Wildcat Mountain,Summit / Highest Elevation,summit,44.2643,-71.2387,4062,false,"Official Wildcat mountain information reports base elevation 1,950 ft and highest elevation 4,062 ft. Coordinate approximates the resort area because the official source gives elevation but not exact station coordinates.",https://www.skiwildcat.com/the-mountain/about-the-mountain/mountain-info.aspx
Wilmot Mountain,Primary Base / Forecast Point,base,42.4994,-88.1886,770,true,"Official Vail/Wilmot mountain information lists base elevation 770 ft and highest elevation 960 ft; mountain-stat elevations, not named weather stations. Coordinates remain the existing approximate resort/base forecast-point coordinates from data/resorts.csv unless a future official station coordinate is found.",https://www.wilmotmountain.com/the-mountain/about-the-mountain/mountain-info.aspx
Winter Park Resort,Primary Base / Forecast Point,base,39.886822,-105.76248980000003,9000,true,"Official Winter Park mountain-stats page lists resort base 9,000 ft and summit 12,060 ft, plus sub-area top/base elevations. Coordinates remain existing approximate resort/base forecast-point coordinates unless an official station coordinate is later sourced.",https://www.winterparkresort.com/the-mountain/mountain-information/statistics
Yakebitaiyama Ski Area,Base / Minimum Ski-Area Elevation,base,36.7507155,138.5184042,5102,true,Official Shiga Kogen Mountain Resort live-status/data page lists Yakebitaiyama Ski Area minimum altitude 1555 m and highest altitude 2000 m; primary uses minimum official course/ski-area altitude. Coordinates remain existing approximate resort/base forecast-point coordinates unless official point coordinates are later sourced. Reclassified from generic forecast_point to base because the row uses the official minimum/base ski-area elevation.,https://www.shigakogen-ski.or.jp/lift/yakebitaiyama/index-en.html
Yokoteyama Ski Area,Base / Minimum Ski-Area Elevation,base,36.6692,138.5264,5594,true,Official Shiga Kogen Mountain Resort live-status/data page lists Yokoteyama Ski Area minimum altitude 1705 m and highest altitude 2307 m; primary uses minimum official course/ski-area altitude. Coordinates remain existing approximate resort/base forecast-point coordinates unless official point coordinates are later sourced. Reclassified from generic forecast_point to base because the row uses the official minimum/base ski-area elevation.,https://shigakogen-ski.or.jp/lift/yokoteyama-shibutoge/index-en.html
Yunding Snow Park,Genting Secret Garden Base,base,40.565488,115.2681,5584,true,"Base forecast point for Genting Resort Secret Garden/Yunding Snow Park. Skiresort.info gives official-resort supplied operating context and elevation range 1,702–2,100 m; official Secret Garden pages were not reliably crawlable. Coordinates approximate for the resort/base complex.",https://www.skiresort.info/ski-resort/genting-resort-secret-garden/
Zao Onsen Ski Resort,Primary Base / Forecast Point,base,38.1672,140.3942,2559,true,Official Zao Onsen ski page identifies Omori Giant as the lowest-altitude course context; primary uses widely referenced Zao base altitude 780 m pending a direct official base number in captured text. Coordinates remain existing approximate resort/base forecast-point coordinates unless official point coordinates are later sourced.,https://zao-spa.or.jp/english/ski/
Zermatt Matterhorn,Primary Base / Forecast Point,base,46.0257,7.751637,5315,true,"Official Zermatt tourism page describes Zermatt at 1,620 m and the Matterhorn Glacier Paradise peak as 3,883 m; primary uses Zermatt village/base altitude. Coordinates remain existing approximate resort/base forecast-point coordinates unless official point coordinates are later sourced.",https://zermatt.swiss/Media/Attraktionen/Talstation-Matterhorn-Glacier-Paradise
Zillertal Arena,Primary Base / Forecast Point,base,47.23,12.14,1903,true,"Official Zillertal Arena FAQ identifies Übergangsjoch at 2,500 m as the highest point; primary uses Zell am Ziller valley/base elevation from existing resort forecast coordinate pending a direct official lower ski-area value. Coordinates remain existing approximate resort/base forecast-point coordinates unless official point coordinates are later sourced.",https://www.zillertalarena.com/en/information-services/holiday-information/faq/
Afton Alps,Summit / Highest Elevation,summit,44.8541,-92.7878,700,false,"Official Vail/Afton Alps mountain information lists base elevation 350 ft and highest elevation 700 ft; mountain-stat elevations, not named weather stations. Official source gives elevation but not exact station coordinates; latitude/longitude reuse the resort forecast-point coordinates and should be treated as approximate, not a surveyed summit/station point.",https://www.aftonalps.com/the-mountain/about-the-mountain/mountain-info.aspx
Alpine Valley (OH),Summit / Highest Elevation,summit,41.5261,-81.2536,1500,false,"Official Vail/Alpine Valley Ohio mountain information lists base elevation 1,260 ft and highest elevation 1,500 ft; mountain-stat elevations, not named weather stations. Official source gives elevation but not exact station coordinates; latitude/longitude reuse the resort forecast-point coordinates and should be treated as approximate, not a surveyed summit/station point.",https://www.alpinevalleyohio.com/the-mountain/about-the-mountain/mountain-info.aspx
Snow Creek,Summit / Highest Elevation,summit,39.4675,-94.971,1100,false,"Official Vail/Snow Creek mountain information lists base elevation 800 ft and highest elevation 1,100 ft; mountain-stat elevations, not named weather stations. Official source gives elevation but not exact station coordinates; latitude/longitude reuse the resort forecast-point coordinates and should be treated as approximate, not a surveyed summit/station point.",https://www.skisnowcreek.com/the-mountain/about-the-mountain/mountain-info.aspx
Paoli Peaks,Summit / Highest Elevation,summit,38.5564,-86.5125,900,false,"Official Vail/Paoli Peaks mountain information lists base elevation 600 ft and highest elevation 900 ft; mountain-stat elevations, not named weather stations. Official source gives elevation but not exact station coordinates; latitude/longitude reuse the resort forecast-point coordinates and should be treated as approximate, not a surveyed summit/station point.",https://www.paolipeaks.com/the-mountain/about-the-mountain/mountain-info.aspx
Mt Brighton,Summit / Highest Elevation,summit,42.54,-83.8115,1330,false,"Official Vail/Mt Brighton mountain information lists base elevation 1,100 ft and highest elevation 1,330 ft; mountain-stat elevations, not named weather stations. Official source gives elevation but not exact station coordinates; latitude/longitude reuse the resort forecast-point coordinates and should be treated as approximate, not a surveyed summit/station point.",https://www.mtbrighton.com/the-mountain/about-the-mountain/mountain-info.aspx
Wilmot Mountain,Summit / Highest Elevation,summit,42.4994,-88.1886,960,false,"Official Vail/Wilmot mountain information lists base elevation 770 ft and highest elevation 960 ft; mountain-stat elevations, not named weather stations. Official source gives elevation but not exact station coordinates; latitude/longitude reuse the resort forecast-point coordinates and should be treated as approximate, not a surveyed summit/station point.",https://www.wilmotmountain.com/the-mountain/about-the-mountain/mountain-info.aspx
Mad River Mountain,Summit / Highest Elevation,summit,40.3186,-83.677,1460,false,"Official Vail/Mad River mountain information lists highest elevation 1,460 ft and longest vertical drop 300 ft; no named weather/snow station is identified. Official source gives elevation but not exact station coordinates; latitude/longitude reuse the resort forecast-point coordinates and should be treated as approximate, not a surveyed summit/station point.",https://www.skimadriver.com/the-mountain/about-the-mountain/mountain-info.aspx
Hidden Valley Ski Area (MO),Summit / Highest Elevation,summit,38.5356,-90.6504,860,false,"Official Vail/Hidden Valley Missouri mountain information lists highest elevation 860 ft and longest vertical drop 320 ft; no named weather/snow station is identified. Official source gives elevation but not exact station coordinates; latitude/longitude reuse the resort forecast-point coordinates and should be treated as approximate, not a surveyed summit/station point.",https://www.hiddenvalleyski.com/the-mountain/about-the-mountain/mountain-info.aspx
Boston Mills,Combined BMBW Highest Elevation,summit,41.2646,-81.5651,871,false,"Official Vail/Boston Mills Brandywine mountain information is a combined two-area page and lists highest elevation 871 ft plus longest vertical drop 264 ft; it does not identify whether this highest point belongs to Boston Mills or Brandywine, nor publish per-area base elevations. Row retained as a combined-destination high-elevation reference, not a precise station. Official source gives elevation but not exact station coordinates; latitude/longitude reuse the resort forecast-point coordinates and should be treated as approximate, not a surveyed summit/station point.",https://www.bmbw.com/the-mountain/about-the-mountain/mountain-info.aspx
Brandywine,Combined BMBW Highest Elevation,summit,41.264,-81.556,871,false,"Official Vail/Boston Mills Brandywine mountain information is a combined two-area page and lists highest elevation 871 ft plus longest vertical drop 264 ft; it does not identify whether this highest point belongs to Boston Mills or Brandywine, nor publish per-area base elevations. Row retained as a combined-destination high-elevation reference, not a precise station. Official source gives elevation but not exact station coordinates; latitude/longitude reuse the resort forecast-point coordinates and should be treated as approximate, not a surveyed summit/station point.",https://www.bmbw.com/the-mountain/about-the-mountain/mountain-info.aspx
The Highlands,Summit Elevation,summit,45.4692553,-84.93534899999997,1325,false,"Official The Highlands resort-stats page lists summit elevation 1,325 ft and base elevation 773 ft; mountain-stat elevation, not a named weather station. Official source gives elevation but not exact station coordinates; coordinates reuse the resort forecast-point location and are approximate.",https://www.highlandsharborsprings.com/media-room/resort-stats
Loon Mountain,North Peak Summit,summit,44.0565389,-71.62957589999996,3050,false,"Official Loon Mountain stats page lists North Peak summit elevation 3,050 ft and base elevation 860 ft; mountain-stat elevation, not a named weather station. Official source gives elevation but not exact station coordinates; coordinates reuse the resort forecast-point location and are approximate.",https://www.loonmtn.com/mountain-stats
Sugarloaf,Summit Elevation,summit,45.0541811,-70.30851089999999,4237,false,"Official Sugarloaf mountain-info page lists summit elevation 4,237 ft and vertical drop 2,820 ft; no named weather station coordinates are provided on this page. Official source gives elevation but not exact station coordinates; coordinates reuse the resort forecast-point location and are approximate.",https://www.sugarloaf.com/mountain-info
Sunday River,Oz Peak Summit,summit,44.4669465,-70.84651939999998,3150,false,"Official Sunday River Meet the Peaks page lists per-peak elevations and identifies Oz as 3,150 ft, the highest listed peak elevation in the captured peak table; no base elevation or sensor coordinate is provided there. Official source gives elevation but not exact station coordinates; coordinates reuse the resort forecast-point location and are approximate.",https://www.sundayriver.com/the-mountain/8-peaks
Copper Mountain,Summit Elevation,summit,39.502141,-106.15099520000001,12441,false,"Official Copper Mountain winter mountain-stats page lists summit elevation 12,441 ft and base elevation 9,712 ft; mountain-stat elevation, not a named weather station. Official source gives elevation but not exact station coordinates in the captured source; coordinates reuse the resort forecast-point location and are approximate.",https://www.coppercolorado.com/the-mountain/mountain-safety-stats/winter-mountain-stats/
Brighton,Top Elevation,summit,40.598166,-111.5829,10500,false,"Official Brighton Resort about page lists top elevation 10,500 ft and base elevation 8,755 ft; mountain-stat elevation, not a named weather station. Official source gives elevation but not exact station coordinates in the captured source; coordinates reuse the resort forecast-point location and are approximate.",https://www.brightonresort.com/about
Crystal Mountain Resort,Lower Northway,other,46.94772,-121.473,3912,false,"Official Crystal Mountain stats page lists Lower Northway elevation 3,912 ft as part of its elevation table. Official source gives elevation but not exact station coordinates in the captured source; coordinates reuse the resort forecast-point location and are approximate.",https://www.crystalmountainresort.com/media/mountain-stats-and-facts
Crystal Mountain Resort,Gondola Summit,summit,46.94772,-121.473,6872,false,"Official Crystal Mountain stats page lists Summit/top of gondola elevation 6,872 ft. Official source gives elevation but not exact station coordinates in the captured source; coordinates reuse the resort forecast-point location and are approximate.",https://www.crystalmountainresort.com/media/mountain-stats-and-facts
Crystal Mountain Resort,Silver King,summit,46.94772,-121.473,7012,false,"Official Crystal Mountain stats page lists Silver King elevation 7,012 ft. Official source gives elevation but not exact station coordinates in the captured source; coordinates reuse the resort forecast-point location and are approximate.",https://www.crystalmountainresort.com/media/mountain-stats-and-facts
Arapahoe Basin,Summit Elevation,summit,39.631106,-105.874058,13050,false,"Official Arapahoe Basin press-kit PDF lists summit elevation 13,050 ft and base elevation 10,520 ft; mountain-stat elevation, not a named weather station. Official source gives elevation but not exact station coordinates in the captured source; coordinates reuse the resort forecast-point location and are approximate.",https://stgabasin.blob.core.windows.net/arapahoe/uploaded/pdfs/abasin%20press%20kit%20final%20small%201920%20winter.pdf
June Mountain,Summit Elevation,summit,37.7679169,-119.09062929999999,10090,false,"Official June Mountain trail-map/mountain-stats page lists summit elevation 10,090 ft and base elevation 7,545 ft; mountain-stat elevation, not a named weather station. Official source gives elevation but not exact station coordinates in the captured source; coordinates reuse the resort forecast-point location and are approximate.",https://www.junemountain.com/mountain-information/trail-map
Bear Mountain,Peak Elevation,summit,34.223238,-116.862169,8805,false,"Official Big Bear Mountain Resort trail-map page lists Bear Mountain peak elevation 8,805 ft and base elevation 7,140 ft; mountain-stat elevation, not a named weather station. Official source gives elevation but not exact station coordinates in the captured source; coordinates reuse the resort forecast-point location and are approximate.",https://www.bigbearmountainresort.com/mountain-information/trail-maps
Snow Summit,Peak Elevation,summit,34.225915,-116.891162,8200,false,"Official Big Bear Mountain Resort trail-map page lists Snow Summit peak elevation 8,200 ft and base elevation 7,000 ft; mountain-stat elevation, not a named weather station. Official source gives elevation but not exact station coordinates in the captured source; coordinates reuse the resort forecast-point location and are approximate.",https://www.bigbearmountainresort.com/mountain-information/trail-maps
Killington,Killington Peak,summit,43.620867,-72.796267,4241,false,"Official Killington mountain-stats page lists Killington Peak at 4,241 ft. Official source does not provide exact coordinates for this named elevation point in the captured source; coordinates reuse the resort forecast-point location and are approximate.",https://killington.com/mountain-stats
Killington,Skye Peak,summit,43.620867,-72.796267,3800,false,"Official Killington mountain-stats page lists Skye Peak at 3,800 ft. Official source does not provide exact coordinates for this named elevation point in the captured source; coordinates reuse the resort forecast-point location and are approximate.",https://killington.com/mountain-stats
Killington,Ramshead Peak,summit,43.620867,-72.796267,3610,false,"Official Killington mountain-stats page lists Ramshead Peak at 3,610 ft. Official source does not provide exact coordinates for this named elevation point in the captured source; coordinates reuse the resort forecast-point location and are approximate.",https://killington.com/mountain-stats
Killington,Snowdon Peak,summit,43.620867,-72.796267,3592,false,"Official Killington mountain-stats page lists Snowdon Peak at 3,592 ft. Official source does not provide exact coordinates for this named elevation point in the captured source; coordinates reuse the resort forecast-point location and are approximate.",https://killington.com/mountain-stats
Killington,Bear Mountain Peak,summit,43.620867,-72.796267,3262,false,"Official Killington mountain-stats page lists Bear Mountain Peak at 3,262 ft. Official source does not provide exact coordinates for this named elevation point in the captured source; coordinates reuse the resort forecast-point location and are approximate.",https://killington.com/mountain-stats
Killington,Sunrise Mountain Peak,summit,43.620867,-72.796267,2456,false,"Official Killington mountain-stats page lists Sunrise Mountain Peak at 2,456 ft. Official source does not provide exact coordinates for this named elevation point in the captured source; coordinates reuse the resort forecast-point location and are approximate.",https://killington.com/mountain-stats
Killington,Annual Snowfall Measurement Level,weather_station,43.620867,-72.796267,4000,false,"Official Killington mountain-stats page states monthly/annual snowfall is measured at the 4,000-foot level below the summit of Killington Peak; treated as a weather/snow measurement elevation but exact coordinates are not published in the captured source. Official source does not provide exact coordinates for this named elevation point in the captured source; coordinates reuse the resort forecast-point location and are approximate.",https://killington.com/mountain-stats
Pico Mountain,Pico Mountain Peak,summit,43.66388,-72.8432,3967,false,"Official Killington mountain-stats page lists Pico Mountain Peak at 3,967 ft in the combined Killington + Pico mountain stats. Official source does not provide exact coordinates for this named elevation point in the captured source; coordinates reuse the resort forecast-point location and are approximate.",https://killington.com/mountain-stats
Alyeska Resort,Summit Elevation,summit,60.96174,-149.09387,3939,false,"Official Alyeska schedule/rates PDF lists summit elevation 3,939 ft and base elevation 250 ft. Coordinates reuse the resort forecast-point location because the source did not publish exact station coordinates in the captured text; treat as approximate elevation anchor, not surveyed point geometry.",https://www.alyeskaresort.com/wp-content/uploads/2023/10/2024-schedule-rates.pdf
Banff Sunshine,Top Elevation,summit,51.111841,-115.744665,8943,false,"SkiBig3 official Banff Sunshine stats list top elevation 8,943 ft and base elevation 5,440 ft. Coordinates reuse the resort forecast-point location because the source did not publish exact station coordinates in the captured text; treat as approximate elevation anchor, not surveyed point geometry.",https://www.skibig3.com/ski/resorts/banff-sunshine/
Lake Louise Ski Resort,Top Elevation,summit,51.44321498486975,-116.16269980353756,8650,false,"SkiBig3 official Lake Louise stats list top elevation 8,650 ft and base elevation 5,400 ft. Coordinates reuse the resort forecast-point location because the source did not publish exact station coordinates in the captured text; treat as approximate elevation anchor, not surveyed point geometry.",https://www.skibig3.com/ski/resorts/lake-louise/
